game,achievement,description,achieved,unlocktime
Emily is Away Too,Winter '07,Complete Chapter 3,False,null
Emily is Away Too,Spring '07,Complete Chapter 4,False,null
Emily is Away Too,Summer '07,Complete Chapter 5,False,null
Emily is Away Too,Never Gonna Give You Up,no description available,False,null
Emily is Away Too,Awe Jeez,Use this Secret Icon,False,null
Emily is Away Too,THE A5G4RD,Use this Secret Icon,False,null
Emily is Away Too,HYPNOSPACE,Use this Secret Icon,False,null
Emily is Away Too,Classic Content,Use this Secret Icon,False,null
Emily is Away Too,The World Needs Heroes,Use this Secret Icon,False,null
Emily is Away Too,Retro Computer Virus,Use this Secret Icon,False,null
Emily is Away Too,Kinda an Achievement,Use this Secret Icon,False,null
Emily is Away Too,...And Friends,Use this Secret Icon,False,null
Emily is Away Too,My GOTY,Use this Secret Icon,False,null
Emily is Away Too,"The Problems of the Future, Today!",Use this Secret Icon,False,null
Emily is Away Too,Is Herobrine Real?,Use this Secret Icon,False,null
Emily is Away Too,Not Liable for Injury/Dismemberment,Use this Secret Icon,False,null
Emily is Away Too,Make. Sail.,Use this Secret Icon,False,null
Emily is Away Too,Zenith Lunar Resort,Use this Secret Icon,False,null
Emily is Away Too,Raise Your Dongers,Use this Secret Icon,False,null
We Were Here,Everything is Better with Friends,Invite a friend to join your game!,True,2024-04-02 14:29:00
We Were Here,The Answer Lies..,Escape from the Storage Room,False,null
We Were Here,..Between The Eyes	,Assisted in escaping the Storage Room ..and no  the answer is not a nose,True,2024-04-02 14:39:19
We Were Here,Is that a..,Escape from the Painting Room,False,null
We Were Here,A face on its..,Assisted in escaping the Painting Room ..and enjoyed fine arts,True,2024-04-02 14:42:33
We Were Here,This is fine,Escape from the Submerged Hallway,False,null
We Were Here,Antarctic Odyssey,Assisted in escaping the Submerged Hallway ..and became a qualified plumber,True,2024-04-02 14:43:27
We Were Here,Dungeons and..,Escaped from the Dungeon ..and the dragon.,False,null
We Were Here,Guiding Light,Assisted in escaping the Dungeon ..and didn’t skip leg day,True,2024-04-02 15:01:38
We Were Here,Ice Physics,Escape from the Frozen Courtyard ..and didn’t lose your cool,False,null
We Were Here,Grandmaster,Assisted in escaping the Frozen Courtyard ..and learned some new tricks,True,2024-04-02 15:20:55
We Were Here,Is that another..,Escape from the Dark Hallway,False,null
We Were Here,South Pole,Assisted in escaping the Dark Hallway ..and learned about cardinal directions,True,2024-04-02 15:29:02
We Were Here,"Lights, camera..",Assisted in escaping the Haunted Theater,False,null
We Were Here,Don’t Turn Around,Escaped the Haunted Theater,True,2024-04-02 15:49:36
We Were Here,Why me?,no description available,True,2024-04-02 15:51:24
We Were Here,Worst Friend Forever,no description available,False,null
We Were Here,Die Hard,Play through the whole game without dying once,False,null
We Were Here,Happy Ending,no description available,False,null
We Were Here,Eye See You,Perfect play  ‘Between the eyes’ ,True,2024-04-02 14:39:19
We Were Here,Myth Busters,Perfect play ‘Painting Room’,True,2024-04-02 14:42:33
We Were Here,What ‘r you doing?,Perfect play ‘Submerged Hallway’,True,2024-04-02 14:43:27
We Were Here,Dungeon Master,Perfect play ‘The Dungeon’,True,2024-04-02 15:01:38
We Were Here,Fools’ Mate,Perfect play ‘Chess’,True,2024-04-02 15:20:55
We Were Here,Vlad The Impaler,Perfect play ‘Spike Hall’,False,null
We Were Here,Killer Performance,Perfect play ‘Haunted Theater’,False,null
West of Loathing,A Real Underdog,Buy a dark horse,False,null
West of Loathing,Looking a Ghost Horse in the Mouth,Buy a pale horse,False,null
West of Loathing,Horse Senseless,Buy a crazy horse,False,null
West of Loathing,A Fistful of Cutlets,no description available,False,null
West of Loathing,WANTED: Alive,Fully populate the Dirtwater jail,False,null
West of Loathing,WANTED: Dead,Fully populate the Dirtwater morgue,False,null
West of Loathing,The Terrible Secret of Cotton Candy,no description available,False,null
West of Loathing,Our Daily Bread,Solve all of Breadwood's problems,False,null
West of Loathing,Won't You Come Out Tonight,no description available,False,null
West of Loathing,Under Pressure,no description available,False,null
West of Loathing,In a Row?,Discover 37 map locations out West,False,null
West of Loathing,KUZPA HOPA,no description available,False,null
West of Loathing,The Blackest Hat,no description available,False,null
West of Loathing,Three Bridges Too Far,Build three kinds of bridges (over three playthroughs),False,null
West of Loathing,Emperormaker,no description available,False,null
West of Loathing,No Country for Old Gods,no description available,False,null
West of Loathing,Meat Mystery,no description available,False,null
West of Loathing,Contributing to the Delinquency of a Miner,Finish the game with Crazy Pete,False,null
West of Loathing,I Love the Way You Shoot,no description available,False,null
West of Loathing,"What's Up, Doc?",no description available,False,null
West of Loathing,Yes! Yes! To Finishing!,no description available,False,null
West of Loathing,The Hard Way,Finish the game with the Hard Hat,False,null
West of Loathing,The Really Hard Way,Finish the game with the Hard Hat in a single game day,False,null
West of Loathing,Number One With a Bullet,Discovered the true secret of Gun Manor,False,null
West of Loathing,Spirit Guide,Dealt with all 13 of the Gun Manor ghosts peacefully,False,null
West of Loathing,These Violent Ghosts Have Violent Ends,Reckoned with all 13 of the Gun Manor ghosts,False,null
West of Loathing,Quakin' In Your Boots,no description available,False,null
West of Loathing,Unrequited,no description available,False,null
House Flipper,Family man,"Family isn't just an important thing, it's everything.",False,null
House Flipper,Geek,"I'm not a genius, but I am smarter than you are.",False,null
House Flipper,Worth every penny,Mind over matter. Money over all.,False,null
House Flipper,I'm a Belieber,Fashion is my armor against the realities of everyday life.,False,null
House Flipper,Wall Street Shark,It's business. Leave your feelings at the door.,False,null
House Flipper,Mr. Mystery,"Bra off, party on!",False,null
House Flipper,Just enough,"Age is just a number. Live life fully, no matter how old you are.",False,null
House Flipper,The Tactical Prepper,Always be prepared for the unknown.,False,null
House Flipper,The Survivalist,"Remember: when disaster strikes, the time to prepare has passed.",False,null
House Flipper,Doomsday Prepper,Better to prep 10 years too early than 10 minutes too late!,False,null
House Flipper,Alpha Male,What happens in the cave stays in the cave.,False,null
House Flipper,Pro-creative,"You know, when you're in love, you can't get any sleep… because of your kids screaming around the clock!",False,null
House Flipper,Artistic soul,Every child is an artist. The challenge lies in remaining an artist throughout one's adult life.,False,null
House Flipper,First money,Complete first job!,True,2023-01-28 16:04:42
House Flipper,Millionaire,Earn your first million euro.,False,null
House Flipper,Game over,Finish the game.,False,null
House Flipper,Do it ASAP,Complete a job in less than 1 minute.,False,null
House Flipper,Perfectionist,Complete every job all the way.,False,null
House Flipper,"Knock, knock",I am the one who knocks.,False,null
House Flipper,Negotiator,"Successfully negotiate a sale earning no less than 50,000 Euro.",False,null
House Flipper,Strongman,Do you even lift?,True,2023-01-28 16:10:42
House Flipper,Car mechanic,You'll need a car mechanic.,False,null
House Flipper,You're doing it wrong.,Kill a cockroach with a hammer.,False,null
House Flipper,Junior estate agent,Sell 10 houses.,False,null
House Flipper,Estate agent,Sell 20 houses.,False,null
House Flipper,Real estate agent,Sell 50 houses.,False,null
House Flipper,Give it some fresh air,Don't forget to take it out of the rain!,False,null
House Flipper,Beginner gardener,It's time to broaden my qualifications!,False,null
House Flipper,Competitor,"Look at my garden, it's amazing!",False,null
House Flipper,Perfect Layout,"Feel Shi… Fence Shi… Well, I tried.",False,null
House Flipper,According to the rules.,"Blue flower, red thorns…",False,null
House Flipper,Fully equipped.,Haven't you forgotten about a place for a few flowers between this sofa and the carousel?,False,null
House Flipper,Call me Edward.,You can't hide from my mover!,False,null
House Flipper,Gardener,I feel this gardener aura inside of me…,False,null
House Flipper,Vegan,Tell the meatatarians my last word is… Carrot…,False,null
House Flipper,Let's go swimming.,Bath time?,False,null
House Flipper,Whack-A-Mole,"Your time has come, Mr. Mole…",False,null
House Flipper,Don Quixote,Is this hammer even real?,False,null
House Flipper,Down to the last penny,Care to do something more with all that's left?,False,null
House Flipper,Truly open space,Must-have: lots of space.,False,null
House Flipper,Whole family,Must-have: room for family gatherings.,False,null
House Flipper,All the possibilities!,On the other hand…,False,null
House Flipper,Chimney sweeper,Can you hear it?,False,null
House Flipper,Modern solutions,Can't have a leak when there are no pipes!,False,null
House Flipper,Time warp,Let's do the time warp again!,False,null
House Flipper,Oliver's way,Now we're talking!,False,null
House Flipper,Greta's touch,This place could use a woman's touch!,False,null
House Flipper,Homer's house,I will not click on the map.,False,null
House Flipper,Renovator,Fix them all!,False,null
House Flipper,Beach please,no description available,False,null
House Flipper,I hope there's no cellar,"Now, who’s in for a pool party?",False,null
House Flipper,Windows update,Replace 10 windows,False,null
House Flipper,The furnisher,One man’s trash is another man’s treasure,False,null
House Flipper,I fixed it!,All it takes is a good smack with a hammer,False,null
House Flipper,Panorama,Take a picture of the city from the Cliff House,False,null
House Flipper,Luxury is always in style,Finish all jobs in Moonrise Bay,False,null
House Flipper,I am rich,Purchase one of the houses from Luxury DLC,False,null
House Flipper,"The Wi-Fi password, anyone?",The next step is to hire a butler,False,null
House Flipper,You are too creative!,"If we allowed you to do this, the game would crash",False,null
House Flipper,Step up your game,Did someone call a stair specialist?,False,null
House Flipper,The choice is yours,Will you follow your client's dream?,False,null
House Flipper,What's in the box?,Tons of cuteness to say the least!,False,null
House Flipper,A journey full of fluffiness,Morgan is proud of you.,False,null
House Flipper,Welcome to Cozy Village,Hope you enjoy the countryside.,False,null
House Flipper,Caretaker,Feels like the beginning of something special.,False,null
House Flipper,"Fresh, clean, and dry",Now your pup can get all dirty again.,False,null
House Flipper,It's playtime!,The best part of the day.,False,null
House Flipper,Tap-tap-tap...,Can you hear those little paws behind you?,False,null
House Flipper,Versatile caretaker,"You're not gonna stop here, are you?",False,null
House Flipper,The floor is your canvas,"Now, that's not a happy little accident.",False,null
House Flipper,Teamwork,"A helping paw is never a bad thing, eh?",False,null
House Flipper,They grow up so fast...,It feels like we've met yesterday!,False,null
House Flipper,Picture perfect,It's hard to get a good photo when they move around so quickly.,False,null
House Flipper,This belongs in a museum,"Careful now, it’s obviously a family heirloom!",False,null
House Flipper,Old McDonald,Is there an animal you haven’t got?,False,null
House Flipper,Drone master,"Making photos, watering, spraying… Everything on the fly!",False,null
House Flipper,The bigger the better,House extensions are just too much fun!,False,null
House Flipper,Music to my ears,"Your house, your rules, your radio.",False,null
House Flipper,Captain Hook,Hope you're not afraid of heights!,False,null
House Flipper,Don’t hold your horses,Ride like the wind!,False,null
House Flipper,Hardworking farmer,Your efforts have yielded a harvest.,False,null
House Flipper,They're all in one basket,Still looking for a golden egg?,False,null
House Flipper,Just don't get lost!,Fancy an afternoon snack with a Minotaur?,False,null
House Flipper,A long day in the countryside,Hard work pays off!,False,null
House Flipper,Talented roofer,Show your true colors!,False,null
House Flipper,Free spirit,"Finally, nothing limits your imagination!",False,null
House Flipper,Appetite comes with eating,no description available,False,null
House Flipper,The way to one's heart…,no description available,False,null
House Flipper,The cherry on top,no description available,False,null
House Flipper,5 Flipper stars,no description available,False,null
House Flipper,Why live on bread and water?,no description available,False,null
House Flipper,Property manager,no description available,False,null
House Flipper,Land in hot water,no description available,False,null
House Flipper,"Table, Deck Yourself!",no description available,False,null
House Flipper,Don't judge a restaurant by its sign,no description available,False,null
House Flipper,Flavours Hunter,no description available,False,null
PC Building Simulator,But can it run Crysis?,Build a PC with parts costing more than $10k and have it boot to desktop.,False,null
PC Building Simulator,Stop it,"Make a PC with full tower case, AIO cooler, at least 1 RGB fan, Maximum RAM supported for the motherboard, any 1080 Ti (or even SLI), but use a Celeron.",False,null
PC Building Simulator,If you fail the first time...,BSOD a computer 10 times from overclocking.,False,null
PC Building Simulator,1920x1080,Install a Threadripper 1920x and a GTX 1080 or GTX 1080ti.,False,null
PC Building Simulator,Calling in Sick,Skip work 7 days in a row.,False,null
PC Building Simulator,"I'm broke, Uncle!",Get into $3000 of debt.,False,null
PC Building Simulator,Overvolted,Break your CPU.,False,null
PC Building Simulator,Building isn't cheap!,Get out of a $2500 debt.,False,null
PC Building Simulator,The Best of Both Worlds,Pair an AMD CPU with a NVIDIA GPU.,False,null
PC Building Simulator,Perfection,Get exactly the requested 3DMark score.,False,null
PC Building Simulator,Hoarder,Have every possible part in your inventory.,False,null
PC Building Simulator,Back in the black,"$1,000 in the bank.",False,null
PC Building Simulator,Seems you're pretty good at this,"$10,000 in the bank.",False,null
PC Building Simulator,You rock at this!,"$100,000 in the bank.",False,null
PC Building Simulator,Maybe you should try something else?,"$1,000,000 in the bank.",False,null
PC Building Simulator,That's what I'm talking about,Complete 10 jobs in a single playthrough.,False,null
PC Building Simulator,Smashing it,Complete 30 jobs in a single playthrough.,False,null
PC Building Simulator,Taking care of business,Complete 100 jobs in a single playthrough.,False,null
PC Building Simulator,Work ethic 101,Complete 200 jobs in a single playthrough.,False,null
PC Building Simulator,"Wow, you really like PCs",Complete 500 jobs in a single playthrough.,False,null
PC Building Simulator,Customer satisfaction,Get a 4 star rating.,False,null
PC Building Simulator,Bending over backwards,Get a 4.5 star rating.,False,null
PC Building Simulator,Customer's ALWAYS right.,Get a 5 star rating.,False,null
PC Building Simulator,Get your wings,Complete How To Build A PC mode,True,2022-07-27 22:25:16
PC Building Simulator,Treat yourself - GPU,Install a GTX 1080Ti in your office machine.,False,null
PC Building Simulator,Treat yourself - CPU,Install a Threadripper CPU in your office machine.,False,null
PC Building Simulator,Treat yourself - RAM,Install 128GB of RAM in your office machine.,False,null
PC Building Simulator,Show off,Get a score of 5000 on your office PC.,False,null
PC Building Simulator,Lead by example,Get a score of 10000 on your office PC.,False,null
PC Building Simulator,Blow 'em away,Get a score of 20000 on your office PC.,False,null
PC Building Simulator,Getting your feet wet,Custom water cool your office PC.,False,null
PC Building Simulator,Stars in your eyes (maybe try squinting),Add loads of lighting to your office PC.,False,null
PC Building Simulator,The Stuart Morton Award for Purpleness,Make your office PC as purple as possible.,False,null
PC Building Simulator,Majority Shareholder,Buy 51% of the company stock from Uncle Tim.,False,null
PC Building Simulator,Owner,Buy all of the company stock from Uncle Tim.,False,null
PC Building Simulator,Going loopy,Create a water cooling loop with 5 or more radiators.,False,null
PC Building Simulator,Wow to build a PC!,no description available,False,null
PC Building Simulator,Sitting on a fortune,no description available,False,null
PC Building Simulator,You need to plug it in...,no description available,True,2022-07-27 22:26:53
PC Building Simulator,"Hasta La Vista, Baby.",no description available,False,null
PC Building Simulator,Amazonian,no description available,False,null
PC Building Simulator,Your music sucks,Play some of your own music in the music player.,False,null
PC Building Simulator,My favourite feature...,Play some internet radio in the music player.,False,null
PC Building Simulator,So you're the reason why the prices are so high?,Have 100 GPUs in your inventory.,False,null
PC Building Simulator,Easy to forget,Forget to apply thermal paste to the CPU.,False,null
PC Building Simulator,From humble beginnings...,Get to level 6.,False,null
PC Building Simulator,Things are under control,Get to level 12.,False,null
PC Building Simulator,Building momentum,Get to level 18.,False,null
PC Building Simulator,Mr big business,Get to level 24.,False,null
PC Building Simulator,Mister Big,Get to level 30.,False,null
PC Building Simulator,Double trouble,Buy the second workbench.,False,null
PC Building Simulator,Triple threat,Buy the third workbench.,False,null
PC Building Simulator,Keeping things neat,Buy the storage cupboard.,False,null
PC Building Simulator,Esports DLC: Stable Configuration,Stick with the Vandals through your entire career,False,null
PC Building Simulator,Esports DLC: Team Player,Work for every available company,False,null
PC Building Simulator,Esports DLC: Playing Favourites,Receive 20 Likes from a single player,False,null
PC Building Simulator,Esports DLC: Top Tier Technician,End your career with a gold watch,False,null
PC Building Simulator,Esports DLC: PC Pro,End your career with a silver watch,False,null
PC Building Simulator,Esports DLC: Repair Rookie,End your career with a bronze watch,False,null
PC Building Simulator,Esports DLC: Remember Me,Get your first gift from a player,False,null
PC Building Simulator,Esports DLC: Modest Collection,Get 10 gifts from players,False,null
PC Building Simulator,Esports DLC: Serious Collector,Get 15 gifts from players,False,null
PC Building Simulator,Esports DLC: The Complete Set,Get all 26 gifts from the players,False,null
PC Building Simulator,Esports DLC: Collector's Item,no description available,False,null
PC Building Simulator,Esports DLC: Race to the Top,Get your team to the top of the league!,False,null
PC Building Simulator,Esports DLC: Friends in High Places,no description available,False,null
PC Building Simulator,Esports DLC: Emoji Whizz,no description available,False,null
PC Building Simulator,Esports DLC: System Failure,no description available,False,null
PC Building Simulator,Esports DLC: Room to Grow,Move into a bigger workshop,False,null
PC Building Simulator,Esports DLC: Living the Dream,Move into the elite workshop,False,null
PC Building Simulator,Esports DLC: Hardware Conflict,no description available,False,null
PC Building Simulator,Esports DLC: Setup Wizard,Set up your whole team in the Arena in 120 seconds or less,False,null
PC Building Simulator,Esports DLC: Clean Sweep,Deal with a disaster in the Arena in 120 seconds or less,False,null
PC Building Simulator,Esports DLC: Purist's Playthrough,no description available,False,null
PC Building Simulator,PC LOAD LETTER,Fix 5 printers by hitting them.,False,null
PC Building Simulator,Free at Last!,Leave your workshop for the first time.,False,null
PC Building Simulator,Growth Strategy,Upgrade to a bigger workshop.,False,null
PC Building Simulator,Executive Suite,Upgrade to an even bigger workshop.,False,null
PC Building Simulator,Making Money,Sell a spare PC.,False,null
PC Building Simulator,Side Hustle,Sell 10 PCs.,False,null
PC Building Simulator,Tim 2.0,Sell 20 PCs.,False,null
PC Building Simulator,Hot TikkIT,Complete 25 tickets yourself.,False,null
PC Building Simulator,Golden TikkIT,Complete 50 tickets yourself.,False,null
PC Building Simulator,TikkIT Master,Complete 100 tickets yourself.,False,null
PC Building Simulator,Employee of the Month,Complete all story jobs by yourself or with Natalia's help.,False,null
PC Building Simulator,Weeeee!,Play on the slide.,False,null
PC Building Simulator,Weeeeeeeeeeeeeeeeeee!,Play on the slide 3 times. Don't you have work to do?,False,null
PC Building Simulator,Retail Therapy,Purchase an item from the DEKOR catalogue.,False,null
PC Building Simulator,Feeling Lucky...?,Buy a Mystery Parts Pack from Uncle Tim's Bargain Basement.,False,null
PC Building Simulator,Money to Burn,Purchase 25 different items from the DEKOR catalogue.,False,null
PC Building Simulator,"Nothing Ventured, Nothing Gained",Buy 15 different Mystery Parts Packs from Uncle Tim's Bargain Basement.,False,null
PC Building Simulator,Matchmaker,Play cupid for two sweethearts on the HypeReach project.,False,null
PC Building Simulator,Reunion Tour,Get Mangled Cabbage back together again for one last concert.,False,null
PC Building Simulator,PCBS Fit Adventure,"Help launch the hit new game, Yoga Simulator.",False,null
Risk of Rain 2,Rapidfire,Reach +200% attack speed.,False,null
Risk of Rain 2,Automation Activation,Activate 6 turrets in a single run.,False,null
Risk of Rain 2,...To Be Left Alone,Stabilize the Cell in the Void Fields.,False,null
Risk of Rain 2,Warm For Life,Die three times while burning.,True,2024-03-10 17:08:40
Risk of Rain 2,Captain: Worth Every Penny,"As Captain, repair and recruit a TC-280 Prototype.",False,null
Risk of Rain 2,Captain: Mastery,"As Captain, beat the game or obliterate on Monsoon.",False,null
Risk of Rain 2,Captain: Wanderlust,"As Captain, visit 10 different environments in a single run.",False,null
Risk of Rain 2,Moon Worshipper,Carry 5 Lunar items in a single run.,False,null
Risk of Rain 2,Glorious Battle,Charge the Teleporter with less than 10% health.,False,null
Risk of Rain 2,Cleanup Duty,Destroy 20 flying rocks in Sky Meadow.,False,null
Risk of Rain 2,Commando: Mastery,"As Commando, beat the game or obliterate on Monsoon.",False,null
Risk of Rain 2,Commando: Godspeed,"As Commando, fully charge the first-stage teleporter before the timer hits 5 minutes.",True,2023-03-30 22:19:45
Risk of Rain 2,Commando: Rolling Thunder,"As Commando, land the killing blow on an Overloading Worm.",False,null
Risk of Rain 2,Commando: Incorruptible,"As Commando, clear 20 stages in a single run without picking up any Lunar items.",False,null
Risk of Rain 2,The Long Road,Complete 20 stages in a single run.,False,null
Risk of Rain 2,Engineering Perfection,Complete 30 stages.,True,2023-03-30 21:44:06
Risk of Rain 2,Washed Away,Beat the game.,True,2023-03-29 21:22:10
Risk of Rain 2,The Calm,Beat the game on Monsoon difficulty.,False,null
Risk of Rain 2,Ascendant,Defeat the Teleporter bosses after activating 2 Shrines of the Mountain.,True,2023-06-11 16:22:18
Risk of Rain 2,Prismatically Aligned,Complete a Prismatic Trial.,False,null
Risk of Rain 2,Advancement,Complete a Teleporter event.,True,2023-03-29 12:54:14
Risk of Rain 2,Flawless,Fully charge a Teleporter without getting hit.,True,2023-03-29 17:00:56
Risk of Rain 2,Warrior,Reach and complete the 3rd Teleporter event without dying.,True,2023-03-29 13:40:52
Risk of Rain 2,Naturopath,"Without healing, reach and complete the 3rd Teleporter event.",False,null
Risk of Rain 2,True Respite,Obliterate yourself at the Obelisk..,True,2023-03-29 20:21:16
Risk of Rain 2,Acrid: Mastery,"As Acrid, beat the game or obliterate on Monsoon.",False,null
Risk of Rain 2,Acrid: Bad Medicine,"As Acrid, land the final blow on a Scavenger.",False,null
Risk of Rain 2,Acrid: Easy Prey,"As Acrid, land the killing blow on 50 total enemies that have 1 hit point left.",False,null
Risk of Rain 2,Acrid: Pandemic,"As Acrid, inflict Poison 1000 total times.",False,null
Risk of Rain 2,Guidance Offline,Defeat the unique guardian of Siren's Call.,True,2023-04-03 14:55:45
Risk of Rain 2,Learning Process,Die 5 times.,True,2023-03-29 13:02:45
Risk of Rain 2,I Love Dying!,Die 20 times.,True,2023-04-07 15:44:53
Risk of Rain 2,Experimenting,Pick up 5 different types of Equipment.,True,2023-03-29 16:32:01
Risk of Rain 2,The Basics,Discover 10 unique white items.,True,2023-03-29 12:48:55
Risk of Rain 2,Engineer: Better With Friends,"As Engineer, recruit 12 minions at one time.",False,null
Risk of Rain 2,Engineer: Mastery,"As Engineer, beat the game or obliterate on Monsoon.",False,null
Risk of Rain 2,Engineer: Zero Sum,"As Engineer, finish charging the teleporter with zero monsters remaining on the stage.",False,null
Risk of Rain 2,Engineer: 100% Calculated,"As Engineer, defeat the teleporter boss in less than 5 seconds after it spawns.",False,null
Risk of Rain 2,"""Is This Bugged?""",Fail the Shrine of Chance 3 times in a row.,True,2023-03-29 20:43:08
Risk of Rain 2,Her Concepts,Find the Altar to N'kuhana.,False,null
Risk of Rain 2,[REDACTED],Open the Timed Security Chest on Rallypoint Delta.,False,null
